{
  "id": "550e8400-e29b-41d4-a716-446655440000",
  "name": "Test Schema",
  "status": "active",
  "count": 42,
  "price": 99.99,
  "isEnabled": true,
  "config": {
    "theme": "dark",
    "notifications": true
  },
  "tags": ["premium", "verified"],
  "metadata": {
    "created": "2024-01-15T10:30:00.000Z"
  }
}